{
  "id": "image-006-330px-Remington_Covers_for_Ballantine_Lord_of_the_Rings_1960s",
  "asset": "assets/image-006-330px-Remington_Covers_for_Ballantine_Lord_of_the_Rings_1960s.jpg",
  "mediaType": "image/jpeg",
  "role": "photo",
  "caption": "Barbara Remington's cover illustrations for the Ballantine paperback version achieved mass-cult status on American college campuses in the 1960s and were later parodied by Bored of the Rings.",
  "alt": "Barbara Remington's cover illustrations for the Ballantine paperback version achieved mass-cult status on American college campuses in the 1960s and were later parodied by Bored of the Rings.",
  "intrinsicSize": {
    "width": 330,
    "height": 182,
    "unit": "px"
  },
  "hash": "sha256:752d80c0a816ddb4ac097ecbafda3620aabdff0c5bd92f49dcdecd8b56f025d7"
}
