{
  "id": "image-005-500px-Beowulf_eotenas_ylfe_orcneas",
  "asset": "assets/image-005-500px-Beowulf_eotenas_ylfe_orcneas.jpg",
  "mediaType": "image/jpeg",
  "role": "photo",
  "caption": "[Beowulf](https://en.wikipedia.org/wiki/Beowulf)'s eotenas ond ylfe ond orcneas, \"ogres and elves and devil-corpses\" helped to inspire Tolkien to create the [Orcs](https://en.wikipedia.org/wiki/Orc) and [Elves](https://en.wikipedia.org/wiki/Elf_%28Middle-earth%29) of [Middle-earth](https://en.wikipedia.org/wiki/Middle-earth).[\\[21\\]](https://en.wikipedia.org/wiki/The_Lord_of_the_Rings#cite_note-Shippey_2005_Beowulf-33)",
  "alt": "[Beowulf](https://en.wikipedia.org/wiki/Beowulf)'s eotenas ond ylfe ond orcneas, \"ogres and elves and devil-corpses\" helped to inspire Tolkien to create the [Orcs](https://en.wikipedia.org/wiki/Orc) and [Elves](https://en.wikipedia.org/wiki/Elf_%28Middle-earth%29) of [Middle-earth](https://en.wikipedia.org/wiki/Middle-earth).[\\[21\\]](https://en.wikipedia.org/wiki/The_Lord_of_the_Rings#cite_note-Shippey_2005_Beowulf-33)",
  "intrinsicSize": {
    "width": 500,
    "height": 81,
    "unit": "px"
  },
  "hash": "sha256:08ea3eb98870355d2736fd7b702ccfc6257f5c2d05b60c512595fa47fda38937"
}
